{
  "$schema": "./codex_upgrade_scenarios.schema.json",
  "schema_version": "codex-upgrade-scenarios/v1",
  "codex_version": "0.151.0",
  "profile_id": "codex-cli-0.151.0",
  "source_spec": {
    "path": "docs/CODEX_CLI_CLIENT_EMULATION_GUIDE.md",
    "fragment": "第二章",
    "sha256": "ee92ff270350557c2d7372eca4eeeee2e2874d025e2afea3d24a3e050d91ee1e"
  },
  "rule_manifest": {
    "path": "tools/official_client_capture/codex_upgrade_rules_0_151_0.json",
    "sha256": "527318710def0db14aa89c433fb0c7ca01fc679f4ea82a4a1b5ccb453cd51951",
    "rule_count": 42
  },
  "variable_contract": [
    {
      "name": "campaign_id",
      "type": "string",
      "required": true,
      "sensitive": false,
      "description": "本次升级 Campaign 的不可变安全 ID。"
    },
    {
      "name": "target_version",
      "type": "string",
      "required": true,
      "sensitive": false,
      "description": "目标 Codex CLI 三段版本号，必须由 Campaign 显式注入。"
    },
    {
      "name": "target_sha256",
      "type": "sha256",
      "required": true,
      "sensitive": false,
      "description": "目标官方 Codex CLI 二进制 SHA-256。"
    },
    {
      "name": "runtime_image",
      "type": "image_reference",
      "required": true,
      "sensitive": false,
      "description": "官方抓包运行时镜像引用，必须含不可变 digest。"
    },
    {
      "name": "repo_root",
      "type": "absolute_path",
      "required": true,
      "sensitive": false,
      "description": "sub2apiplus 仓库根目录绝对路径。"
    },
    {
      "name": "capture_root",
      "type": "absolute_path",
      "required": false,
      "sensitive": false,
      "default": "/root/oauth-capture",
      "description": "远端抓包与证据根目录。"
    },
    {
      "name": "capture_container",
      "type": "string",
      "required": false,
      "sensitive": false,
      "default": "capture-cli",
      "description": "隔离抓包容器名称。"
    },
    {
      "name": "service_container",
      "type": "string",
      "required": false,
      "sensitive": false,
      "default": "sub2apiplus",
      "description": "候选服务容器名称。"
    },
    {
      "name": "keeper_container",
      "type": "string",
      "required": false,
      "sensitive": false,
      "default": "sub2apiplus-keeper",
      "description": "候选 keeper 容器名称。"
    },
    {
      "name": "postgres_container",
      "type": "string",
      "required": false,
      "sensitive": false,
      "default": "sub2apiplus-postgres",
      "description": "候选 PostgreSQL 容器名称。"
    },
    {
      "name": "redis_container",
      "type": "string",
      "required": false,
      "sensitive": false,
      "default": "sub2apiplus-redis",
      "description": "候选 Redis 容器名称。"
    },
    {
      "name": "capture_codex_bin",
      "type": "absolute_path",
      "required": false,
      "sensitive": false,
      "default": "/usr/local/bin/codex-capture",
      "description": "抓包容器中的官方 Codex CLI 路径。"
    },
    {
      "name": "relay_codex_bin",
      "type": "absolute_path",
      "required": false,
      "sensitive": false,
      "default": "/root/.local/bin/codex",
      "description": "官方复杂状态链使用的 Codex CLI 路径。"
    },
    {
      "name": "model",
      "type": "string",
      "required": false,
      "sensitive": false,
      "description": "目标版本 main 轨模型，必须由 Campaign 显式注入。"
    },
    {
      "name": "lite_model",
      "type": "string",
      "required": true,
      "sensitive": false,
      "description": "目标版本 lite 轨模型，必须由 Campaign 显式注入。"
    },
    {
      "name": "codex_account_id",
      "type": "integer",
      "required": true,
      "sensitive": false,
      "description": "专用 OpenAI OAuth 验收账号 ID。"
    },
    {
      "name": "api_key_id",
      "type": "integer",
      "required": true,
      "sensitive": false,
      "description": "专用 ingress API Key 数据库 ID；清单中禁止保存 key 值。"
    },
    {
      "name": "build_id",
      "type": "string",
      "required": false,
      "sensitive": false,
      "description": "候选构建流水线或制品的不可变安全 ID；官方阶段为空。"
    },
    {
      "name": "deployed_version",
      "type": "string",
      "required": false,
      "sensitive": false,
      "description": "候选服务实际部署版本；官方阶段为空。"
    },
    {
      "name": "candidate_image_id",
      "type": "string",
      "required": false,
      "sensitive": false,
      "description": "候选运行容器实际 image ID；官方阶段为空。"
    },
    {
      "name": "source_tree_sha256",
      "type": "sha256",
      "required": false,
      "sensitive": false,
      "description": "候选源码树摘要；官方阶段为空。"
    },
    {
      "name": "live_attestation_compose_dir",
      "type": "absolute_path",
      "required": false,
      "sensitive": false,
      "description": "候选部署的 docker compose 工作目录；A11 需按本轮四元组重建服务以启用 candidatecapture provider。"
    },
    {
      "name": "live_attestation_compose_files",
      "type": "string",
      "required": false,
      "sensitive": false,
      "description": "候选部署的 compose -f 参数串；恢复时按同一串拉回原部署。"
    }
  ],
  "required_client_bindings": [
    "kilo-compatible",
    "kilo-responses"
  ],
  "evidence_scenarios": [
    {
      "scenario_id": "A01",
      "description": "默认系统 CA 的 HTTP ClientHello 与 models 请求",
      "trigger": "使用隔离账号执行一次启动 models 和一次 HTTP Responses 调用。",
      "preconditions": [
        "Ubuntu 24.04",
        "未配置有效自定义 CA",
        "候选出站 netns 抓包已启动"
      ],
      "required_artifact_kinds": [
        "pcap",
        "process_trace"
      ],
      "covers": [
        "SPEC-TLS-001",
        "SPEC-PROTO-001",
        "SPEC-H1-001",
        "SPEC-H1-002",
        "SPEC-H1-004",
        "SPEC-EP-002",
        "SPEC-EP-013"
      ]
    },
    {
      "scenario_id": "A02",
      "description": "四次彼此独立的 Responses WS ClientHello",
      "trigger": "每次重启候选进程后分别触发一次 Responses WS 握手。",
      "preconditions": [
        "至少四份独立 pcap",
        "内置 OpenAI OAuth",
        "未配置有效自定义 CA"
      ],
      "required_artifact_kinds": [
        "pcap"
      ],
      "covers": [
        "SPEC-TLS-003"
      ]
    },
    {
      "scenario_id": "A03",
      "description": "Responses HTTP Lite、zstd 与 HTTP turn-state 闭环",
      "trigger": "使用 Lite 模型执行两轮 HTTP Responses，并由受控上游在首轮注入 turn-state。",
      "preconditions": [
        "use_responses_lite=true",
        "enable_request_compression=true",
        "字节中继开启"
      ],
      "required_artifact_kinds": [
        "relay_binary",
        "process_trace"
      ],
      "covers": [
        "SPEC-H1-001",
        "SPEC-H1-002",
        "SPEC-H1-003",
        "SPEC-H1-004",
        "SPEC-HDR-001",
        "SPEC-HDR-004",
        "SPEC-HDR-006",
        "SPEC-HDR-007",
        "SPEC-BODY-001",
        "SPEC-BODY-002",
        "SPEC-BODY-003",
        "SPEC-BODY-004",
        "SPEC-BODY-005",
        "SPEC-BODY-006",
        "SPEC-EP-001",
        "SPEC-EP-005",
        "SPEC-EP-013"
      ]
    },
    {
      "scenario_id": "A04",
      "description": "Responses HTTP 非 Lite、按样本标注压缩条件及条件 Header 矩阵",
      "trigger": "使用非 Lite 模型分别触发 residency、subagent、memgen、parent thread 和 runtime metrics 分支。",
      "preconditions": [
        "use_responses_lite=false",
        "压缩开启与关闭样本分别以 labels.compression 标注",
        "各条件分支分别留有正负样本"
      ],
      "required_artifact_kinds": [
        "relay_binary",
        "process_trace"
      ],
      "covers": [
        "SPEC-H1-001",
        "SPEC-H1-003",
        "SPEC-HDR-002",
        "SPEC-HDR-008",
        "SPEC-BODY-001",
        "SPEC-BODY-002",
        "SPEC-BODY-005",
        "SPEC-BODY-006",
        "SPEC-EP-001"
      ]
    },
    {
      "scenario_id": "A05",
      "description": "Responses WS Lite S2、turn-state 与压缩上下文",
      "trigger": "执行两轮 Lite WS 会话并由受控上游回送 response.metadata turn-state。",
      "preconditions": [
        "WS 握手成功",
        "permessage-deflate 已协商",
        "原始双向字节完整"
      ],
      "required_artifact_kinds": [
        "relay_binary",
        "websocket_trace"
      ],
      "covers": [
        "SPEC-PROTO-002",
        "SPEC-WS-001",
        "SPEC-WS-002",
        "SPEC-WS-004",
        "SPEC-WS-005",
        "SPEC-HDR-004",
        "SPEC-HDR-006",
        "SPEC-HDR-008",
        "SPEC-BODY-001",
        "SPEC-BODY-003",
        "SPEC-BODY-004",
        "SPEC-BODY-005"
      ]
    },
    {
      "scenario_id": "A06",
      "description": "Responses WS 非 Lite、warmup 与增量帧",
      "trigger": "在同一 WS 会话依次执行 warmup、首轮和可复用前缀的增量请求。",
      "preconditions": [
        "use_responses_lite=false",
        "上游返回可复用 previous_response_id",
        "原始 WS 帧完整"
      ],
      "required_artifact_kinds": [
        "relay_binary",
        "websocket_trace"
      ],
      "covers": [
        "SPEC-WS-001",
        "SPEC-WS-002",
        "SPEC-WS-005",
        "SPEC-BODY-001",
        "SPEC-BODY-005"
      ]
    },
    {
      "scenario_id": "A07",
      "description": "WS 重试预算耗尽后的 HTTP fallback",
      "trigger": "受控中继连续返回足量可重试 WS 失败，直到同一调用改发 HTTP POST。",
      "preconditions": [
        "故障次数由冻结场景配置",
        "入口 invocation_id 全程可追踪",
        "不得手工发起独立 HTTP 请求"
      ],
      "required_artifact_kinds": [
        "relay_binary",
        "process_trace"
      ],
      "covers": [
        "SPEC-PROTO-002"
      ]
    },
    {
      "scenario_id": "A08",
      "description": "HTTP Client 生命周期与 retry 连接关系",
      "trigger": "分别执行跨上层调用、keepalive 500 重试和受控断连重试。",
      "preconditions": [
        "使用隔离账户固定到同一上游",
        "三种分支分别记录 invocation_id 与 connection_id",
        "样本完整性检查通过"
      ],
      "required_artifact_kinds": [
        "relay_binary",
        "process_trace"
      ],
      "covers": [
        "SPEC-CONN-001",
        "SPEC-HDR-001"
      ]
    },
    {
      "scenario_id": "A09",
      "description": "models、legacy compact、alpha-search 与 images 辅助链",
      "trigger": "分别触发 models、显式 legacy compact、两阶段搜索、图像生成与编辑。",
      "preconditions": [
        "各端点使用独立调用",
        "legacy 分支显式关闭 remote_compaction_v2",
        "字节中继开启"
      ],
      "required_artifact_kinds": [
        "relay_binary",
        "process_trace"
      ],
      "covers": [
        "SPEC-H1-001",
        "SPEC-H1-003",
        "SPEC-HDR-004",
        "SPEC-HDR-006",
        "SPEC-HDR-007",